source,text
3114,"I want to be a good composter, but turning my pile is backbreaking work.  
I was looking through a gardening magazine today and I saw a contraption that was basically a three foot long pole that had 6"" arms that fold in along the side when pushing in, and then expanding out when you pulled it out.  The idea is that you just plunge it in and pull it out a bunch of times and blammo - aeration.

From Double Winged Compost Aerator
Do these types of things actually work, or do I just need to stop being lazy if I want to aerate my pile?


Your pile will compost without turning it, but it goes faster if you turn it.  A pitchfork and a little bit of work every few weeks or months will do just fine
"
3118,"I have a vegetable garden that bugs just love. Since my family is going to eat these vegetables (and I'd prefer that the bugs do not), what organic pesticide is most effective? The main culprits are aphids and cabbage loopers (or inch worms) though any pesticide that targets critters that eat leafy vegetables would be helpful.


I use neem seed oil effectively. From the wikipedia article (emphasis not in original):

Formulations made of neem oil also find wide usage as a bio-pesticide for organic farming, as it repels a wide variety of pests including the mealy bug, beet armyworm, aphids, the cabbage worm, thrips, whiteflies, mites, fungus gnats, beetles, moth larvae, mushroom flies, leafminers, caterpillars, locust, nematodes and the Japanese beetle. Neem oil is not known to be harmful to mammals, birds, earthworms or some beneficial insects such as butterflies, honeybees and ladybugs if it is not concentrated directly into their area of habitat or on their food source.

"
3119,"My girlfriend got a rose to sprout and then planted. It grew nicely but now spider mites are coming back all the time.
She tried a BAYER spray for mite control but they are coming back every time she has the rose plant inside the house.


Either soap and water applied at 5 to 6 days intervals with particular attention being paid to get good coverage on the underside of the leaves or keeping the rose outside would solve this problem.  This answer is very detailed; I recommend looking at it.
"
3123,"This harvest I was not able to pick a single corn cob.  Some large animal(s), I suspect raccoons, got to them before they were ripe (I would find peeled and gnawed corn littering the lawn and the corn stems bent down when I got home).  I had crushed garlic all over the garden.  This kept the rabbits away, but was not effective against the large animal.
I am looking for a solution that does not involve putting a fence around my garden patch.  Are there plants that raccoons are repelled by?  Has someone tried prickly plants to make the patch unattrative to raccoons?  I am told these are very intelligent animals, so I think the solution will have to be a mix of good ideas.


When the corn is about 1-2 weeks from being ready for human consumption put a battery powered radio tuned to an all night talk radio station in your corn patch.  Music does not work.  The raccoons will avoid the ""humans"" for a while.  You have to time this carefully to your corn crop because after a couple of weeks the 'coons will figure that those voices they hear are not really people.  You have to have your corn harvested before then.
"
3126,"This harvest I was not able to pick a single corn cob.  Some large animal(s), I suspect raccoons, got to them before they were ripe (I would find peeled and gnawed corn littering the lawn and the corn stems bent down when I got home).  I had crushed garlic all over the garden.  This kept the rabbits away, but was not effective against the large animal.
I am looking for a solution that does not involve putting a fence around my garden patch.  Are there plants that raccoons are repelled by?  Has someone tried prickly plants to make the patch unattrative to raccoons?  I am told these are very intelligent animals, so I think the solution will have to be a mix of good ideas.


My solution for large omnivorous varmint problems (opossums and skunks, here) is a Havahart trap.  I release them far from anyone's home, a few miles away.  I've gotten rid of over a half-dozen opossums and a half-dozen skunks with it.
You need to use bait that's specific to what you're trying to catch.  You don't want to catch Fluffy from next door.  For racoons, marshmallows are a good choice - except that skunks like them too.  I can explain how to deal with skunks if needed.
The nice thing about this solution is that it's semi-permanent - till the next varmint moves in.
"
3134,"In another question I was advised to use pea gravel for french drains.
Now, as it happens, a previous owner put down a lot of weed matting and covered it with perhaps 5cm of gravel.  My best guess, from looking at this page, is that the gravel is equivalent to 3/8"" crushed stone.  Can I use that instead of pea gravel?


Crushed gravel is the media of choice for providing drainage.  What you want is to have the maximum amount of airspace in the drainage layer so water has somewhere to go.  Normally you would use 5/8"" or even 7/8"" crushed gravel but 3/8"" will do.  Pea stone gravel would not be my first choice as it will pack down over time and provide less airspace than the irregular shapes of crushed gravel.
If you want to be diligent you can give the gravel you dig up a quick wash to separate out any dirt or other loose material.
And, when in doubt, add more drainpipe with sleeve!  There is no reason you cannot have several layers of drainpipe on top of each other in particularly difficult to drain areas.
"
3135,"In the office there is an abundance of fluorescent light and that's about it. The temperature stays around 70 ºF (21 ºC)  I think.
Could I grow a fruiting plant in these conditions? I may be able to add a lamp with a full spectrum light bulb to help the plant out.  It can't be anything fancy though.
I was hoping I could grow a small hot pepper plant, but I don't mind if I have to settle for something else.


You can probably get a number of fruiting plants to flower and set fruit once indoors.  I have seen coffee plants, citrus and members of the fig family flower and set fruit or seed indoors under fluorescents.  
The problem is that flowering and fruiting takes a lot of energy.  If the plant does not have more illumination than standard indoor light levels allow this comes from energy stored in the roots.  The usual issues with growing indoors also apply, low humidity, lack of pollinators.
I believe you would be most successful with a citrus plant like a Calamondin orange.  If you can grow it in a high light area next to a window during the flowering then you could sustain in under fluorescents during the fruit cycle.
"
3137,"I'm growing some seedlings in a tray that has a plastic lid. The sun causes moisture to condense on the lid. I was wondering: is this counter-productive, as the condensation then blocks the sun? 



In general, seed trays should be uncovered when you have full germination, or you can lift seedlings into other flats as they germinate.  An anti-fungal can be sprayed or sprinkled on the seed before planting and/or just on the soil surface.  I use ground cinnamon and have never lost a plant to fungus.  In the case of raising orchids, cinnamon should always be used.
"
3138,"In the office there is an abundance of fluorescent light and that's about it. The temperature stays around 70 ºF (21 ºC)  I think.
Could I grow a fruiting plant in these conditions? I may be able to add a lamp with a full spectrum light bulb to help the plant out.  It can't be anything fancy though.
I was hoping I could grow a small hot pepper plant, but I don't mind if I have to settle for something else.


Peppers and some tomatoes will easily fruit indoors, provided they get enough light. You might want to try indoor avocados too, and keep the size small by pruning.
"
3146,"I would like to build a paver patio next to a large tree that has a 3"" wide root at ground level.  I do not want to damage the roots of the tree, so it seems like my only option is to build a raised paver patio.  If I do build a raised paver patio what material should be used for the perimeter? I assume the roots will be a problem when building the perimeter, for instance if I need to bury the perimeter 4"" deep how do I deal with roots that may only be 1"" deep?  Am I putting the tree at risk by burying the surface roots under a patio?  I've considered building a raised deck instead, but I would really prefer a paver patio.  Are there any other options for dealing with a situation like this?
Thanks for the help.
Edit: I believe the tree is a New Zealand Christmas tree.  It's 20'-25' tall.  The patio would be about 5' away from the trunk.


Established trees like things just the way they are.  I killed a tree by doing just what you are planning.  The reason that trees don't take well to grade changes is that most of their roots are within 6"" of the surface.  An substantial amount of gas and water exchange goes on in the soil near the surface.
If you build over the roots it is like putting a blanket on someone's face.  The tree roots cannot breathe.
Roots will grow out as least as far as the drip line of the branch farthest from the trunk. If you still want to build a patio you should not cover more than one third of the total area under the drip line of the tree. The roots will die in this area but will regrow.
"
3149,"I've heard that coffee grounds are a good ""green""(nitrogen rich) to put in your compost, but I was wondering if I could throw the filter in there as well?  They are the standard ""accordion side"" white ones.


The paper ones? Sure - they're just like blotting paper and break down quickly. The usual things that can make some papers questionable should not be present (plastic coatings, metal and/or oil based inks) - or if they are present, you need to quickly change your filter brand!
What I would probably do if possible, is to try and tear the paper a little so that it all mixes up more easily and quickly.
"
3150,"I've heard that coffee grounds are a good ""green""(nitrogen rich) to put in your compost, but I was wondering if I could throw the filter in there as well?  They are the standard ""accordion side"" white ones.


Yes, you can add coffee grounds with their filters to your compost pile. Because they are wet, they decompose fairly quickly. The filters may dry out you if leave them on top of the pile in dry weather. Keep it inside the pile and keep it moist. Also, worms compost the grounds and filters very fast. I have a five tray worm factory and I just drop the whole filter with the grounds in and close the lid, and my army of five thousand redworms eat it in less than a week. I found filters to be easy to compost in almost any composter. If you have a two week ComposTumbler you will want to shred them before you add them, to keep it even. 
"
3157,"I found what looks like a good raised vegetable garden soil mixture: 1/3 top soil, 1/3 compost manure, and 1/3 peat moss. Should I go by weight or volume?


A formula like this, unless specified otherwise,  is (ok, almost) always by volume.
"
3177,"I'm looking into setting up an aquaponics system, which requires me to acquire a large tub (on the order of 250L, relatively flat) to use as a grow bed for the veggies. Does anyone know where I could look to find a source of such tubs? Perhaps disused from some other purpose? All those I've seen commercially seem exorbitantly expensive for what they offer.
In addition, I've read something about ""food grade"" materials (usually regarding plastic) for this use. If the containers are not designed for growing good, how can I determine whether the material is suitable?


Restaurant supply houses offer a wide variety of food grade equipment that can be repurposed.  I also see food grade containers like totes and olive barrels available at my local recycler.
A supplier like this has a wide selection however they are not pretty.  If you want something that does not look industrial you need to find an outdoor pond or even a koi supplier.
"
3180,"I have a clear 100 foot north-south swath through a wooded lot.  If I plant fruit trees (apples, peaches, plums, pears) would it be best to put them on the east side (shaded in the morning) or the west side(shaded in the afternoon) or right in the middle?  I live in Austin, TX and it gets damn hot in the long summers.
Thank you.


In your area, if you have to cut part of the light back, It would be best to cut it off the end of the day. Why? Well, starting at the beginning of the season, we find that fruit trees need their morning sun to get them warmed up for the day. In an area that has only afternoon sun the trees are noticeably behind others grown in morning sun. In summer, The trees will benefit from the shade in the afternoon, especially in your area. Fall and winter benefits would be minimal. If you were living in Vermont I would definitely advise planting in afternoon sun.
"
3186,"I have recently acquired a new 33 x 33 ft plot in the West Country (south west England). I was just wondering with a new baby and limited time, what would be the best vegetables to grow, to maximize the output. Do you have any time saving ideas or advice?
The soil is pH 7, loamy and only slightly weedy.


Bearing in mind the ""limited time"" and ""new baby"" factors I would suggest:
Courgettes
Will produce a big harvest for not a lot of effort and are good to puree for babies. They will take up quite a lot of space but your plot isn't small.
Beans
Runners and French beans take very little looking after and french beans are usually popular with little ones.
Tomatoes
I disagree with @bstpierre, I think they're fairly easy to grow and such a big winner on taste versus the shop version that it's worth the effort.
"
3197,"For a while, when I looked at plants in catalogs, I thought that PVP was part of the name of the plant until I saw the same name without it. What does it mean?


PVP stands for ""Plant Variety Protection"", which is a patent on the particular variety/cultivar that is sexually propagated. From this site:

What is PVP? Plant Variety Protection (PVP) is a patent on a sexually propagated plant variety. PVP protects rights of ownership for the people who develop and release a cultivar for a period of 20 years. At the same time, there is full disclosure of how the variety was developed, making information available to anyone who wants it so that additional genetic advances can be made.

"
3200,"In May, I took some greenwood forsythia cuttings, dipped them in a hormone rooting powder and planted them in rooting mix. The mix was kept moist all year. I had thought they had rooted because they began to grow rapidly and the new shoots hardened off. In October the plants dropped their leaves, and by November they were dead. I dug them up and they had not rooted. There wasn't even a trace of root. What caused it to do this and how do I prevent it?


I don't think the problem is forsythia specific - I've had the same experience with peach cuttings. The first time I tried it I took the cuttings at the wrong time of year (ie. a different unrelated problem), but the second time I took them at the right time and I had one success out of about half a dozen cuttings.
All of the failures in the second batch showed some leaves. Many were either too small (possible a problem specific to peaches where a cutting should be a minimum size); or with the larger cuttings when I dug them up, any roots had rotted away and the stem was beginning to rot. I believe this is your problem. The rot (or mold - rot is after all usually a kind of mold) is due to too much moisture. In your case you describe the mix as being moist all year - so it was probably too moist.
In my case I probably had more variability (outside, Texas, hand watering) - so it was probably too moist at a critical time.
"
3205,"I have quite a few daffodils planted around the perimeter of my garden, and although I see them spreading each year, I was wondering whether I could help thicken the daffodil border without buying new bulbs.
Should I dig up bulbs and split them? Or is that likely to damage them?
Is there something else I should do to encourage spreading?


I do this in early fall after the year's growth has died down, but before they start their winter growth. I dig up the entire clump, and do either of two options:

Pull it into several evenly sized pieces(whatever size you need) and replant to the same depth, without removing the earth from the bulbs. 
Remove the earth from the bulbs, clean it and trim the tops and roots. Then sort them and replant the large bulbs along the border. The smaller bulbs can be discarded or planted as a filler between the big bulbs, to grow to blooming size in the row.

"
3206,"I have a pretty steady access to about 4 pots of coffee worth of coffee grounds each day. I have heard coffee grounds are great for a compost pile, but I am wondering how much is too much? Is there a good ratio to maintain between coffee grounds and other compostable material?


If you add enough carbon, then you can't really put too many grounds in. 
Coffee grounds are 20 carbon to 1 nitrogen or 20/1. A good ratio is 30/1 for aerobic composting, So lets say you use leaves to compost the grounds with. leaves are 50/1, so a mix of 66.67% coffee grounds to 33.33% leaves would be a good mix. Remember that this is by weight, so shredding the leaves will help make it easier to measure. Of course the condition of the material can change the ratio, but it is always safer to put in too much carbon than too much nitrogen. You can use any high-carbon material; I only used leaves as a quick example. 
"
3208,"I'm sure I've heard before that the time to harvest potatoes is when the flowers fall off. Is that right or is it more complicated than that? For example, does it differ based on climate or variety, etc.?


Every time I've grown potatoes, there's been a day when the plants as a whole just all collapse. Distressed, I've dug up to see what's going on, and ended up with perfectly nice potatoes. If that doesn't happen to you, then do it before a frost, because potatoes aren't one of those vegetables that is nicer for frost exposure.
(Actually I grow them in a stack of tires, so ""dug"" isn't quite the right word, but ""knocked over"" doesn't make sense without the context.)
Given the size difference between ""new potatoes"" and ""ordinary potatoes"" in the store, and the historical role of potatoes as an everyday staple, I'm pretty sure there's a huge range of acceptable harvest times. The only downside of too early is that you might have got more by waiting. So don't do all the plants at once until you know you're done for the year - either because the plants have died or because there's a frost coming.
"
3210,"I'm sure I've heard before that the time to harvest potatoes is when the flowers fall off. Is that right or is it more complicated than that? For example, does it differ based on climate or variety, etc.?


If you harvest when the flowers fall you will get a more tender potato, better for frying and boiling. If you wait until the tops are dried, you get the best storage potatoes, better for mashing and baking. Harvesting over time is easier on you and gives a steady supply.  
Also, there is nothing wrong with frost on the vines at maturity, because the vines are useless to the plant at that time. The vines are going dormant like most other perennials do near the hardest time of year. Frost might make the vines dry out, but you don't need to worry unless you are going to get a hard freeze. You will want to harvest the rest of your potatoes before the hard freezes start.
"
3218,"An advertisement of Zephirine Drouhin rose said that this rose was disease resistant, shade tolerant, alkaline soil tolerant, pollution tolerant, more floriferous than other varieties, and completely thornless. I suppose they are probably being optimistic about it: I would especially like to know about the thornlessness. Are these really completely thornless?


I have a Zephirine Drouhin Rose that has been growing in USDA zone 4 for two years.  It puts on a great show, grows fast, resistant to powdery mildew but it is not thornless.
Compared to the shrub roses I have you can work with it without gloves.  There are not many thorns, perhaps one every inch on the larger stems only.  The thorns are a 1/4"" in length and as picky as you would expect.
"
3219,"Last year I grew aubergines (eggplants) and tomatoes with grafted rootstocks, and they actually produced a lot more veg than my other plants. 
Could someone tell me why it is done and why they produced more veg?


The principle is to combine the superior growing/rooting characteristics of the root stock with a graft either:

a. that cannot be grown from a seed (e.g. hybrid); and/or
b. whose roots/infrastructure is inferior to that of the rootstock in some way; and/or
c. whose flowers/fruit/leaves are superior to those of the rootstock in some way (e.g. better pest resistance, larger fruit, more fruit).

The fact that the graft produces more or better fruit than the rootstock would is simply due to genetic difference within the species or subspecies (i.e. tiny differences). The main reason why the graft is not just propagated directly by its own seeds is that the rooting and other infrastructure of that graft is known to be weaker and thus more vulnerable to weather, disease, etc, than the rootstock.
"
3224,"I've heard a lot of anecdotes and shortcuts, but I am still unclear at to how to properly winterize a power push lawnmower. What steps or maintenance tasks should I take in order to keep it in good condition the following year?



Drain the fuel tank
Check the oil level, topping it off as necessary. (You may want to think about changing the oil as well)
Tilt the mower onto its side, and clean off any grass or debris which is stuck to the deck
Inspect the blade.  If it is damaged or dull, take it off and sharpen or replace it if necessary

"
3225,"I've heard a lot of anecdotes and shortcuts, but I am still unclear at to how to properly winterize a power push lawnmower. What steps or maintenance tasks should I take in order to keep it in good condition the following year?


I've had good luck with simply adding a bit of Sta-bil to a full tank, run it for a couple of minutes, and then parking it.
I usually wait until the spring to change the oil, clean/replace the spark plug, sharpen the blade, etc although you do want to make sure that there's no buildup of grass or other debris that will hold moisture against the body.
"
3226,"I've heard a lot of anecdotes and shortcuts, but I am still unclear at to how to properly winterize a power push lawnmower. What steps or maintenance tasks should I take in order to keep it in good condition the following year?


The proper answer is ""read the manual and do what it says"".  There is usually a list of maintenance that should be performed once a season.
Some common items:

Drain the fuel, or run it until it is empty.
Change oil
Check/replace spark plug
Replace air filter
Replace fuel filter
Scrape clippings from under the deck
Blade sharpen/balance, replace blade if necessary (do you have a torque wrench?)
Touch up any spots on the cutting deck with chipped paint and/or rust
Lube the wheel bearings
Lube the control cables
Put a tiny bit of oil in the cylinder and crank the engine a few times.

Many people skip a lot of these things.  How much did you pay for your mower?  How much is it worth to you to keep it in good condition?
I would also recommend NEVER using ethanol gas in your lawnmower as it leaves a residue like corn syrup on the carburetor.
"
3227,"I got two tiny grapefruit seedlings for free and I don't know how to care for them. They are in very small pots and all the care they are getting is watering. They are 2"" tall. I don't live in the right zone for these, and I don't have any idea how to care for them. How do I grow these indoors under artificial light? 
Edit: I need an answer fast. Two of three trees are now dead.


There are a few common issues with citrus grown indoors.

I have seen them get 5 or 6 feet tall indoors, we are talking a plant that wants to be a tree!
If it gets enough light indoors normally the environment is dry enough to encourage spider mites.  Seeing your citrus webbed by mites is not a pleasant sight.  Higher humidity discourages mites. Soap and water will control but not eliminate an advanced infestation.
most soil less mixes popular for indoor mixes are ph neutral.  If you have alkaline water over time the soil mix becomes alkaline and nutrient deficiencies can show up.  The most common is the veins of the leaves are green and the rest of the leaf is yellow. Normally this is a deficiency in iron or manganese.  I deal with this by adding garden soil yearly.  It may be as alkaline as your water but seems to  have more accessible nutrients.
oh, and very sharp thorns

"
