source,text
1631,"It is said that if you let your runner/french beans reach full maturity, the plant stops producing. 
So I harvest my beans (even if only to throw/give them away) regularly to prolong cropping.
How thorough do I need to be? Is it sufficient to regularly pick most of the beans that are ready or do I have to ensure I catch every single bean pod?


I have the opposite situation from Mancuniensis: I only harvest dry beans, so I never pick them before they are mature. I haven't studied them to find the exact moment when they stop flowering, but in my experience, flowering seems to slow down when the beans start to bulge inside the pods.
"
1638,"I'm getting ready to till about 1,000 square feet, but the problem is I have no experience buying tillers. However, I don't know much about buying them. What should one look for in a garden tiller that's appropriate for the size of my garden?


Another thing to consider is the fact that your garden might eventually contain strawberries, horseradish, garlic, kale, onions, asparagus etc... some things you might want to keep from year to year. 
This will reduce the tillable area in your garden by quite a bit. 
Also, in the spring, you might wind up with parts of your garden that are too wet to till and parts of your garden that don't even need all that much tilling. 
For all this and more, a gas powered mantis sort of gizmo is the best option in my opinion. Even if you get a big tiller down the road, you'll still be able to use the mantis to work up the bed after your spring crops.  
In your smallish garden, you're probably not going to leave enough room between rows to run a big tiller, so you'll at most get one use out of a big expensive thing in your garage. 
"
1643,"My mother and I purchased some pepper plants from Costco. The info card they came with (which identifies them as Capsicum annuum bell peppers†) depicts vibrant red bell peppers. However, they've started to sprout their fruit, and we're noticing they're distinctly green.
Mom hears tale that peppers turn red if you don't pick them from the plant. Is this fact, will the pepper change color when left on the plant past its full growth? Is this only for particular breeds of pepper? If it does change color, is there a specific length of time I should wait, or perhaps some way to tell when the color change is complete?
†The card doesn't clarify much past that. Just says ""pepper"" matures in ""60-100 days"", and talks about both mild peppers and hot peppers.


Green peppers are ""unripe"" (even though we often eat them that way). They get their final color -- red, orange, etc. -- as they ripen.
So your mother is right: if you leave them on the plant to ripen, they will turn the red color shown on the card. It sounds like the card was generic for all capsicum annuum, 60-100 days is a pretty wide range... if you knew the named variety of pepper, you could get a better idea of when to expect it to fully ripen.
And as they ripen, they develop their full flavor. (I.e. red sweet peppers are sweeter than green, and red hot peppers are hotter.) If you keep picking the green peppers, the plant will produce more fruit. If you allow the fruits to ripen to red, the plant thinks it has fulfilled its mission in life by creating seeds for another generation, and stops setting more fruit.
"
1651,"I'm getting ready to till about 1,000 square feet, but the problem is I have no experience buying tillers. However, I don't know much about buying them. What should one look for in a garden tiller that's appropriate for the size of my garden?


I own a pretty large tiller.  The next step up would be a garden tractor with an attachment.  Until my wife started farming on large property we really didn't use it that much.  One thing to consider in the equation is the maintenance costs.  If you hardly use it it might not be cost effective.  A neglected machine is a maintenance issue. 
Renting is a good idea until you discover that you are going to use it more than once or twice per year.  Or better yet, become friends with someone you can borrow from.
For your size plot you will want one of the big rigs.  Forget the little ones - you definitely need self-propelled with rear tines.  
"
1652,"My mother and I purchased some pepper plants from Costco. The info card they came with (which identifies them as Capsicum annuum bell peppers†) depicts vibrant red bell peppers. However, they've started to sprout their fruit, and we're noticing they're distinctly green.
Mom hears tale that peppers turn red if you don't pick them from the plant. Is this fact, will the pepper change color when left on the plant past its full growth? Is this only for particular breeds of pepper? If it does change color, is there a specific length of time I should wait, or perhaps some way to tell when the color change is complete?
†The card doesn't clarify much past that. Just says ""pepper"" matures in ""60-100 days"", and talks about both mild peppers and hot peppers.


The above answers are correct, and ripening on-the-stem is always preferable, but it is possible to ripen them after picking. As @yoda points out, they do tend to shrivel and dry, but this might be desirable (eg. In a dry environment, you could do this as a precursor to making chili powder). However, the ripening process can be speeded up by putting the picked peppers with some ripening bananas. Both use an ethane ripening mechanism. So a ripening banana will give off ethane which promotes ripening in the peppers. It is the same mechanism that causes multiple bananas to ripen quickly when they are in a plastic bag. I haven't tried putting peppers and bananas in a plastic bag together but that would be the next logical experiment.
"
1671,"I frequently see small trees staked with some support twine or rope, presumably to aid against strong winds.
However, I've heard or read somewhere that staking small trees can actually be harmful, preventing them from building a natural resistance to the wind (in trunk strength, root development, etc.).
There are many guides that explain ""proper"" tree staking. Here are a few examples:

How to Stake a Tree
Staking Trees

It seems, from aggregating information in such guides, that staking is sometimes necessary, but that people often do it wrong.
The question then, is how do you determine when to stake a tree (if at all)? Are there lots of oddly bent or fallen trees somewhere from lack of staking? I've never seen one.


Below are a few things I've picked up over the years:

Location.

It's generally recommended to stake trees planted on slopes and/or windy locations.
If a tree is planted in a well protected area (and on flat ground) staking shouldn't be necessary and is in fact discouraged ie Let the tree develop naturally.

Staking should not hold a tree so rigid that it can't ""sway"" a little bit.

Swaying encourages a thicker trunk and a stronger root system.
Which ever method is used to stake a tree, it should not cut into the trunk. Any sign of such behaviour should be immediately corrected.

Staking is not needed or should be removed once a tree trunk is approximately 3inches (75mm) in diameter.

"
1686,"I've been trying to find out what weed this is (see photo), but I can't seem to find a definitive answer.
The weed mainly grows in the hedges of the garden, and appears to be choking it. It twists up the stems of the hedges like a vine. One hedge has already died completely because of this weed.
I've been cutting it off at the stem, but the weed is very deeply rooted and is very hard to get rid off. Does anyone know of any (ecological) ways of removing this weed permanently?




Not even knowing what the weed is I would recommend one course of action. What I would do is first find the weed where it comes out of the ground. Then cut it off about a foot or so above the ground. If there any leaves left spray or paint them with Round Up or other applicable herbicide. If there are no leaves just wait for some leaves to appear and then treat them. I would remove all the dead vines from the plant to help prevent seeds from falling. After you have done all that keep an eye out for any new seedlings getting started. Those should easily pull out by hand. That should take care of it. Good luck. 
"
1687,"I've been trying to find out what weed this is (see photo), but I can't seem to find a definitive answer.
The weed mainly grows in the hedges of the garden, and appears to be choking it. It twists up the stems of the hedges like a vine. One hedge has already died completely because of this weed.
I've been cutting it off at the stem, but the weed is very deeply rooted and is very hard to get rid off. Does anyone know of any (ecological) ways of removing this weed permanently?




This looks very much like a Hop plant  (Humulus), a vigorous twining climber with  coarsely serrated (toothed) leaves that have three to five lobes. 
Hops are difficult to eradicate, even with a weedkiller; a neighbor of mine has several on his vegetable plot and has unsuccessfully been trying to remove them, without resorting to chemicals, for several years.
Unless you're willing to take the chemical route - you could spray their leaves with Roundup before they flower - the only options are probably hand-pulling and continually cutting the stems down to ground level to weaken their root system, or turning the hops to good account by using them for home-brewing ;)
"
1688,"Are chili plants an annual plant? I have read on the web that they are perennials. But mine have never lasted more than a year.


Technically, they are perennials, but they tend not to do well over winter. I have managed to over winter them. But I have to grow them in pots and bring them in (to avoid frosts), and then they grow slowly and seem prone to disease, lack of sun, etc. Hence most people (including myself now) grow them as annuals.
"
1692,"If you want that very welcome leek crop in mid-winter, you have to start thinking about them early on in the spring growing season. They're such a long time in the ground. Well, I got mine in on time but I've been neglecting them ever since. Next door's chickens paid a visit and damaged some patches of leek seedlings so I threw in some optimistic late sowings to fill in the gaps. Later some thinning was required but I left it rather late.
The result is a row of leeks which range from OK to severely undersized (some less than 0.5cm, many less than 1cm). Is it too late (mid-August) now for these feeble looking plants to swell up in time for a winter crop? 
And when exactly do leeks slow down and stop swelling? At what point later on this year should I stop looking for progress and just be happy what I've got?


I've had a similar problem with my leeks this year. I sowed them on time but, soon after they germinated, went away on holiday for three weeks and on my return found that they were smothered in weeds. I hand-weeded the plot promptly and later transplanted all 120 (backbreaking!), but they are still very puny - about the same size as yours. 
Leeks require about 90 days from thinning/ transplanting to maturity, so if we have a mild autumn and you enriched your soil before planting, your leeks (and mine) should have ample time to swell up before they're lifted. If I'm not mistaken, you live in the south of England, where it's warmer, so yours will probably catch up better than mine ;)
"
1699,"Is it 100% safe to handle the soil by bare hands? Would any toxic insect hide inside the soils? 


Insects are rarely a problem. The only one I can think of that might bite in soil, would be ants.  Also avoid the blatantly obvious like digging into wasp/hornet/etc nests!
I think you are probably thinking of bacteria and other microbes. Generally you will be fine, no problems; but beware of animal (and human) urine and faces contaminating the soil. Also use gloves if you have cuts - this is how tetanus (a virus) spreads. Or just have your tetanus vaccination.
"
1703,"Gardening guides, when discussing rhubarb, will always illustrate their advice with a picture of some fancy forcing jars, or else reclaimed old-fashioned chimney pots, which look great and add decoration to the garden.

But man, are those things expensive. Does anyone have any tips for cheaper alternatives? Doesn't matter if it's an eyesore. 
Dustbins are sometimes mentioned but they're too large surely.



I'd probably use 5 gallon pails, we have a bunch of these hanging around.
(I think you have horses) How about a feed bucket or one of the larger watering buckets for the horses? (Especially if you have such a bucket that's been kicked/dropped/cracked -- since you said an eyesore is ok, a little duct tape will cover up the crack and exclude light.)
As far as dustbins go, a smaller office-size recycle bin doesn't seem like it would be too tall and they're inexpensive at your local office-supply store.

None of those are as heavy as the pottery will be, so put a rock on top to keep them from blowing around your garden.
"
1709,"I've seen many people in one of my local forums say that their purple basil turned green a while after planting. There were no proper conclusions to this problem, so could someone please explain?
In my own experience, I planted a purple basil from seed. It started with purple leaves until it was medium sized, and then its leaves started to turn green.


I do not have personal experience with this, but based on some discussion here it looks like the hybrids that generate purple basil can at times be unstable and revert to the traditional green basil. 

The plant's hybrid parentage may cause its genetic instability when grown from seed; leaf color often varies from plant to plant and large numbers of pure green plants maybe be produced.

Another possibility mentioned on that page is that they will sometimes revert if they do not get enough sun.
Finally from here there is at least one type of basil that starts out purple and turns green as it matures: African Blue Basil.
"
1717,"We have seen several questions recently about compost tea. We have also seen questions about manure tea and at least one question that referred to compost leachate as ""compost tea.""
What are the differences between these products/concoctions and how are they used? Are there any dangers associated with any of these products? 
A good answer should define and give uses for at least one of the following items 

compost tea
herbal tea
manure tea
compost leachate



What I saw referred to as Compost Tea as answers in this question was more similar to what I read was called ""Vegetarian Manure Tea"" (or maybe green manure tea) in Tips for the Lazy Gardener.  One of the keys to making manure tea is to make sure you use Composted Manure!  Hence the confusion.  If you don't want to get sick, it's best to call nothing at all manure tea and avoid the temptation to liquefy poop and spread it on your garden.
It's certainly good to make a distinction between Compost Leachate and Compost Tea.  I'd think that anything called ""Tea"" should be something steeped like herbal tea is. 
Although maybe in British English it should be called an ""Infusion"". 
"
1722,"A week ago I harvested an orange Bell pepper from my garden. It was still halfway green, so I put it on our kitchen counter to ripen. When I finally cut it open for a salad after a week of ripening, it had a horrible ammonia smell, unlike anything I've ever experienced from a vegetable. Visually, there was nothing wrong with it, but the smell was a clear sign that something was rotten.
What can cause an ammonia smell from a pepper?


I'd agree with mfg that ammonia smell is highly uncommon (sure, the smell of rotting stuff is puke-worthy, but not close to ammonia) for a bell pepper plant. 
The primary way in which ammonia is released into the atmosphere naturally is by putrefaction of living matter. Anything that contains proteins or amino acids (contains an -NH2 bond), when broken down, releases ammonia (NH3). Although wikipedia lists proteins as being 0.86% by weight of a bell pepper, it is possible that your variety (or this particular one) had an excess. 
So, combined with other coincidental factors such as infection of the plant, lack of proper air circulation once outside the plant, anaerobic microbes, etc., it is possible that ammonia was actually produced, although the chances are slim. 
"
1729,"I have started to grow moss indoors and am looking for more advice.
I saw some information online, but I am hoping to clarify some points here.

If I keep the moss in a closed jar then how do I avoid molding?
Do I need to put soil in the jar?
What do to in winter?

Also, are there health concerns with growing moss indoors? Can the spores be contained if grown in a closed glass container?


Go here, Moss Grower's Handbook and download the PDF, or use the direct link below:

Direct link to PDF - Moss Grower's Handbook

Then flip to page 8 of 87, ""2. Bags, jars, and sandwich boxes""
In fact I would recommend reading the complete book if you have a real interest in Moss and growing it.
"
1734,"Recently we relocated a cactus into a new flowerpot. When it was planted the soil would evenly occupy the flowerpot and adjoin the flowerpot side walls. The soil isn't cactus soil, but just regular soil that we bought from a local shop.
Now the soil shrank, formed a stiff cylinder and that cylinder no longer adjoins the flowerpot side walls - there's about 10 millimeters of air on one side of the soil cylinder and the other side seems to have slanted onto the pot side wall.
The cactus looks just fine.
Is that a problem? How do I address it? Do I loosen the soil or should I just leave it untouched?


I've seen this happen with soil mixes containing peat that dry out. It may happen with other potting media too. The problem is that when you want to water, most/all of the water is going to just run down the side and not be absorbed by the soil. The preventive measure is to never let peat dry out -- which is possibly more water than your cactus wants. Backing up a step, it would probably be better to use a more appropriate soil mix.
I know nothing about cacti, so I'm not sure if this will be good for the plant, but re-wetting soil that has dried out that much can be hard. Assuming the pot has drainage holes in the bottom, you can place it in a shallow tray of water until the soil has reabsorbed enough moisture to expand back to normal.
If possible, you may want to repot into a potting medium that's more appropriate for cacti -- i.e. soil that can get dried out without contracting.
"
1749,"Are chili plants an annual plant? I have read on the web that they are perennials. But mine have never lasted more than a year.


They don't tolerate frost at all. But I have several indoor plants 3 years and older, which do very well in spring when light conditions improve.
Of my balcony peppers which I store on the attic stairs during winter usually about half survive it, being very ill tended in that time.
"
1751,"After cursing all the slugs in my yard and removing the few that I could catch, I was quite shocked yesterday to discover 100+ young plants all chewed to the ground.
I was going out at 9 - 10pm to find the slugs but was only seeing one or two per night.
Last night I went out at 12:30am and noticed just under 10 millipedes having a feast in what was left.
So how can I do battle with millipedes? I know they stay just under the surface during the day. My patch is heavily utilized so I don't want to remove everything to deal with them.


Fortunately, I have never had to do battle with millipedes, so I can't suggest a remedy based on personal experience. However, a quick online search has come up with this article which suggests the following control measures:

Remove as much garden debris as possible, since this is an ideal breeding ground for them
Drench the soil where they are with an insecticidal soap
Wherever possible, dry out damp areas
Hand-pick them off your plants and soil

"
1756,"Something has been eating my tomatoes just as they begin to ripen. Each day I've been finding one or more tomatoes half-eaten but still attached to the vine. On a couple of days I've also found bits of tomato skin scattered around a wooden chair a few feet away from the tomato plants.  
I haven't seen the critter(s) in the act. I'm guessing it's a squirrel, as we have lots of them in the neighborhood, but it could be some other small mammal.
I've grown tomatoes in the Sacramento region for years and this is the first time I've had this problem. Does anyone have any ideas on whether it's likely to be a squirrel or some other animal? More importantly, is there anything I can do to keep the critters away?
Update: I've selected a ""best"" answer, but please feel free to add your suggestions if you have a better idea. I'd love to find a way to deter the tomato-eating critters without going to the trouble of enclosing my tomato garden in a net.


I sprinkle cayenne pepper on the fruits and around the base of the plant, and this seems to keep the squirrels away.
Cayenne is also available as a ""hot pepper wax spray"" which may also work.
"
1758,"A few of my peppers are, it seems, suffering blossom end rot - first identified a week or two ago - this is based on the descriptions on the condition elsewhere on the site, but here's a few pics to help confirm:



From what I read on here, and in other locations on the web, the afflicted fruits can't be ""cured"" of this state; any damage done is permanent. So:

Is an afflicted fruit ever salvageable (for the purposes of being eaten)?
Should I be removing afflicted fruit from the plant as soon as the condition is noticed?
Or should I wait for a certain level of severity before acting?
Or maybe there is some obscure benefit to leaving the fruit on the plant?



Yes, this is blossom end rot. The fruit is salvageable since BER is a disorder and not a disease, but there is no particular benefit in leaving it on the plant, in fact it is better to remove it:

By giving sufficient water to the plants, BER can be
  reduced or eliminated. Pick off any affected fruits
  because they will not recover and will only drain
  moisture and calcium needed by healthy fruit. It is safe
  to eat the undamaged parts of fruits with Blossom End
  Rot. Merely cut away the blackened part.

Rutgers Co-operative Research Extension
There is a very full article on BER by the Royal Horticultural Society here, which you should find helpful in preventing the disorder in future.
"
1760,"I have 4 small chili plants (sorry not sure what variety they are), they have 3 sets of leaves. I re-potted them from a seed tray about 2 weeks ago. I'm a bit concerned the plant pot is too big? When growing from seeds how many times should I re-pot and into what sizes?



To me that pot looks about big enough for 1 plant. And only with daily watering care if it is hot. Even if that many plants ""work"", you won't get more peppers from them than from 1 big healthy plant.
I usually repot once directly to my main growing locations. I may put left overs into medium sized joghurt cups to give away or repot again eventually, but there seems to be no difference in which plants do better.
"
1762,"I have low spots in my yard that I would like to slowly fill in.  This isn't anything big enough to constitute a truck load of dirt or anything. What can I use (either dirt or manure) to fix these spots?


The benefit of ""dirt"" is that it won't settle as much as manure, so you won't need to keep adding to it. But, depending on what ""dirt"" you use, it may be lacking in organic matter and nutrients. If you're buying commercial bagged soil, check the label to see what it has in terms of organic matter and fertilizer.
The benefit of cow manure is that it will provide those areas with lots of organic matter and nutrients. Horse manure has the same benefit, but comes with the problem that it can contain a lot of weed seeds.
Depending on where you live, soil and/or manure might be free for the hauling. If you have the choice of poor quality soil and manure, take a little of both and mix them. In my case, I have lots of free manure and not much soil, so I tend to fill low spots with manure. When they settle I add a little more.
"
1764,"A few of my peppers are, it seems, suffering blossom end rot - first identified a week or two ago - this is based on the descriptions on the condition elsewhere on the site, but here's a few pics to help confirm:



From what I read on here, and in other locations on the web, the afflicted fruits can't be ""cured"" of this state; any damage done is permanent. So:

Is an afflicted fruit ever salvageable (for the purposes of being eaten)?
Should I be removing afflicted fruit from the plant as soon as the condition is noticed?
Or should I wait for a certain level of severity before acting?
Or maybe there is some obscure benefit to leaving the fruit on the plant?



As Mancuniensis' answer says, pick them as soon as you see damage and cut away the bad parts. 
One other reason for picking them immediately is that you don't want to leave spoiled/damaged fruit on the plant. This will let bugs get in -- they'll spoil the fruit completely (and could eventually cause harm otherwise healthy parts of the plant).
"
