source,text
738,"My Fescue Grass does fine here in my shady South Carolina yard. However, it needs to be re-seeded every year or it gets bare patches. Are there any alternatives that do not involve buying more seed every year (besides chopping down my trees and planting a sunny grass or naturalizing the area)?


There is a type of fescue called RTF (Rhizomatous Tall Fescue) which I think works better than most common types of fescue.  It has the ability to send out runners underground that will fill in bare patches over time.  I've had it for a couple of years in my front yard and have been very happy with it.
"
741,"What are some herbs that are perennials, i.e. they return and grow the next season? I'd like to keep a garden of herbs around for cooking. 


Lots of herbs are perennial, including these basic favourites:

Chives
Mint
Oregano
Rosemary
Sage
Tarragon
Thyme

Parsley will be around for a year and a bit but will start to bolt in its second spring/summer.
There's a very full list of perennial herbs here or else here.
"
743,"What are some herbs that are perennials, i.e. they return and grow the next season? I'd like to keep a garden of herbs around for cooking. 


Fennel, in addition to the ones already listed by Tea Drinker, is also a perennial.
"
746,"I have created a monster of a compost heap on my property (3 meters, by 2 meters, by almost 2 meters tall) next to an old granite rock wall. Anyway, I mostly put all my grass clippings (primary offended of volume of material) as well as leaves and other material. I just started doing this because I didn't think it would be good to have the local rubbish company haul this off.
As of late, the pile has started getting a bit bigger than I want it to, and it exudes a sickly sweet smell.  What can I do to speed up the decomposition of all this vegetation?  I don't mind the smell that much, since it's pretty far from the house.  However, will any process I initiate cause any other odours to come from it that may be more noticeable than the current smell?
I'm not after dirt, just trying to lessen my impact a bit (and stop that smell).
Will some of those organic disintegration agents work (like a stump dissolver)?


Bad smelling compost is usually a sign of too much nitrogen material in your compost.  If you have too much nitrogen in your compost it will start to generate ammonia.  You need a balance of 1 part nitrogen to 30 parts carbon based material to have a good compost pile.  Your grass clippings are a source of nitrogen and are probably the main problem.  It's not a big deal if you can balance it with enough carbon based material.  Dried leaves, wood chips, straw, and shredded newspaper are a good source of carbon.  
"
747,"Does it generate a new head?  Or is it then done for the year?  What can I do to encourage larger heads?  


If you cut off the head (central spear) when the flower shoots are well developed, but before the tiny flower buds have opened, the plant will not grow another one, but will produce side shoots which you can pick regularly for five or six weeks; however, if you let any of them flower, the plant will stop producing them.
If you choose a sunny site, work enough manure or compost into the soil in autumn and, if necessary, lime (the ideal pH for broccoli is 7.0 - neutral) - better to manure and/or fertilize first, and then wait at least a couple of months before applying the lime - you should get some good-sized heads. Corvet is a very good variety: it produces a large head and, once decapitated, a succession of secondary shoots. 
"
748,"I have created a monster of a compost heap on my property (3 meters, by 2 meters, by almost 2 meters tall) next to an old granite rock wall. Anyway, I mostly put all my grass clippings (primary offended of volume of material) as well as leaves and other material. I just started doing this because I didn't think it would be good to have the local rubbish company haul this off.
As of late, the pile has started getting a bit bigger than I want it to, and it exudes a sickly sweet smell.  What can I do to speed up the decomposition of all this vegetation?  I don't mind the smell that much, since it's pretty far from the house.  However, will any process I initiate cause any other odours to come from it that may be more noticeable than the current smell?
I'm not after dirt, just trying to lessen my impact a bit (and stop that smell).
Will some of those organic disintegration agents work (like a stump dissolver)?


I've been composting for the past few years. In my research, there are a few two main causes (besides the excess nitrogen pointed out by shane): too much moisture and adding things that are not compostable.
You should not add things like dairy products and meat scraps, they might a part of your problem. The solution for moisture is the same for to much nitrogen. Adding dried leaves, wood chips, newspaper can help soak up some of that excess moisture. Also, turn the compost regularly. I turn mine about once a month. 
With that said, you can considerably cut back on the material you are adding by using a mulching lawnmower. Some people say that using a mulching mower is one of the best things you can do for your lawn.
"
750,"I've been wanting to plant a mango seed; though I live in Phoenix, Arizona.
Firstly, would a mango seed actually grow in my area? Secondly, I'm pretty new to any kind of plant life. So, does anyone have any information on germinating and planting a mango seed?


I can't find the link, but I remember reading that the best eating mangoes are clones from well-established, known-to-be-tasty mango trees. Branches are grafted on to rootstock and allowed to grow.
I'm still waiting to find out in my 3 year old mango tree's fruit will be good (I didn't know about the clone thing when I planted it).
"
753,"I have a lot of what I think is Clover in my garden. Should I be concerned?




The photo on the left does look like clover, but it could also be wood sorrel (oxalis).  You'll know for sure once it flowers.  Neither one should concern you, really.  Although some people consider them to be unsightly in their lawns, clovers provide nectar for various insect species (especially bees) and some can be quite pretty. Some wood sorrels are considered ornamental so you may want to keep it if it turns out to be oxalis. It looks like it's in a location where it can easily be removed by hand so if you don't want the plant there just dig it up.  
As winwaed writes, the seedlings in the right-hand photo could be almost anything.
"
760,"I have created a monster of a compost heap on my property (3 meters, by 2 meters, by almost 2 meters tall) next to an old granite rock wall. Anyway, I mostly put all my grass clippings (primary offended of volume of material) as well as leaves and other material. I just started doing this because I didn't think it would be good to have the local rubbish company haul this off.
As of late, the pile has started getting a bit bigger than I want it to, and it exudes a sickly sweet smell.  What can I do to speed up the decomposition of all this vegetation?  I don't mind the smell that much, since it's pretty far from the house.  However, will any process I initiate cause any other odours to come from it that may be more noticeable than the current smell?
I'm not after dirt, just trying to lessen my impact a bit (and stop that smell).
Will some of those organic disintegration agents work (like a stump dissolver)?


The other answers are very correct, but they left out one important aspect, which is to add some dirt to your heap between adding more organic matter.  You've got a lot of surface area to cover, but that grass'll break down to nothing if you keep up on it. 
Also, you probably should break it into more manageable piles by putting partitions in between your huge piles of dead grass.  It would be good to not put new stuff right on top of last years stuff so you can actually get at it if it ever finally breaks down. 3 partitions is probably ideal.  One you add to, one you use and one that is is currently decomposing. 
"
773,"This discussion of seed storage got me wondering if it is feasible to harvest seeds from vegetables (I'm partial to tomatoes) as I cut them up for consumption. 
Generally, I buy seeds each year. But if I have a steady supply, and it's not ill-advised, could I not save seeds for the next year? If so, what steps should I take? Is there a reason not to save vegetable seeds?


In theory yes.  In practice, often no.  A lot of annual vegetable seed that you get are hybrids, which means that they are not genetically stable.  Next years plants will not be as productive as this years, if they are productive at all.  This is especially true of conventional seed, which the seed companies intentionally breed to under perform in future years so you have to keep buying seed.  
It is less true of heirloom plants.  So if you have heirlooms you're more likely to have success with seed saving.
"
776,"I have to grow my plants indoors because it does get cold enough in Dallas sometimes that frost may occur or even snow.
However, we have a small household cat. She has bit our bamboo plant leaves in the past.  We really can't just place them in the window where it would be ideal for the plant.
The cat loves to sit by the window. We could hang it up higher but it's not practical to water them. Also, it would provide her another fun ""toy"" to jump and swat with her paws.
Any recommendations on keeping her from biting our plants?


She's probably looking for some fiber in her diet. There are special grasses you can get that are good for cats: maybe just grow a little pot of one of those and she'll ignore the other plants. We did that for our cat when she was an indoors cat, and that worked fine. Now, she only knocks down plants when she's being clumsy :)
"
790,"A firm believer in 3-year crop rotation, I sow my runner beans in a different plot every year. After they crop, I dig their stems and roots into the soil, to replenish it with their captured nitrogen; I then dismantle the bamboo support frame and reconstruct it elsewhere. To avoid this hassle, several of my gardener friends dig in plenty of manure and use the same plot year after year - and their plants thrive and crop well (sometimes better than mine!). If their long-term failure to ‘sow by the rules’ has depleted the soil of certain nutrients, it certainly isn’t apparent. Is it really necessary to rotate runner beans?


The manure is going to include other nutrients as well nitrogen - there's probably a sufficient spread of nutrient types that depletion is slow or non-existent.
One advantage of your rotation is that your beans are adding nitrogen to the soil in different parts of the garden. You should also be less prone to pests - which it sounds like isn't currently a problem for you and your friends in your area at the moment.
"
796,"A firm believer in 3-year crop rotation, I sow my runner beans in a different plot every year. After they crop, I dig their stems and roots into the soil, to replenish it with their captured nitrogen; I then dismantle the bamboo support frame and reconstruct it elsewhere. To avoid this hassle, several of my gardener friends dig in plenty of manure and use the same plot year after year - and their plants thrive and crop well (sometimes better than mine!). If their long-term failure to ‘sow by the rules’ has depleted the soil of certain nutrients, it certainly isn’t apparent. Is it really necessary to rotate runner beans?


If you work new soil into your beds every year I don't see any point in crop rotation.  Composting your stems and roots, along with some manure, kitchen scraps (coffee grounds, etc), and leaves during the summer and then working that into your soil prior to planting your new crop next spring is a great way to keep your soil nutrient level fresh.
"
797,"I am planning to try my hand at asparagus next spring, although I'm told that it isn't the easiest of vegetables to grow. Are there any particular problems associated with it? Any tips that might smooth my path would be much appreciated (I live in the UK).


I'm growing asparagus this year for the first time, so I wouldn't classify myself as an expert on this...yet. ;)  However, I do have a stand of apparently healthy asparagus in progress at this moment!
My asparagus was planted ""bare root"".  I'm not sure if you can get it other ways or not.  It took several weeks to start coming up.  We're watering it almost every day, but I don't think this is typically needed.  I live in North Texas and we're in the middle of one of the longest dry spells we've seen in a while, plus temperatures are hitting above 100 on a regular basis.  Asparagus doesn't like it's roots to be kept too wet and can have problems with root rot if kept too wet.
You probably already know this part, but asparagus can take several years to grow enough to actually yield a crop.  It's a big plant too, so allow 1 1/2 to 2 feet between each plant.
"
798,"I am planning to try my hand at asparagus next spring, although I'm told that it isn't the easiest of vegetables to grow. Are there any particular problems associated with it? Any tips that might smooth my path would be much appreciated (I live in the UK).


Since it is a perennial, you can't fix the soil as easily as annuals once you've planted it.
So now is the time to:

Get your pH right by adding lime or sulfur as needed
Add organic matter so it has time to break down in the soil
Get any perennial weeds in the area to be planted under control

"
802,"I've read that spent coffee grounds work well as a fertilizer.  But the methods of application are all over the map.  Some indicate using it in compost, others suggest spreading it and broken eggshells as an insect deterrent,  and others recommend making a ""tea"" (heh!) out of it to water plants.  Personally I've just taken my coffee filter outside to clean it and hoped for the best.
Is there any particular reason to pick one application method over the rest or should I just do what's easiest?


Dumping any food in your garden sounds like a good idea at first, but the pitfall is that we must process the food before using it as a fertilizer. For the food is not decomposted into the simplest form, thus various bugs such as Springtail which eat decaying matter. This is the reason why we need composting instead of dumping the food right in your field.
"
812,"I've read that spent coffee grounds work well as a fertilizer.  But the methods of application are all over the map.  Some indicate using it in compost, others suggest spreading it and broken eggshells as an insect deterrent,  and others recommend making a ""tea"" (heh!) out of it to water plants.  Personally I've just taken my coffee filter outside to clean it and hoped for the best.
Is there any particular reason to pick one application method over the rest or should I just do what's easiest?


One thing to avoid is using coffee grounds inside where there is a risk of mold growth (as there would be if you left the grounds in your pot for a week)

Likewise, I would avoid using coffee
  grounds with potted houseplants, not
  only because of the potential for
  fungal growth but also potential
  buildup of soluble salts.

-B. Rosie Lerner (Extension Consumer Horticulturist Purdue University)
Grounds for Gardening
"
813,"I have to grow my plants indoors because it does get cold enough in Dallas sometimes that frost may occur or even snow.
However, we have a small household cat. She has bit our bamboo plant leaves in the past.  We really can't just place them in the window where it would be ideal for the plant.
The cat loves to sit by the window. We could hang it up higher but it's not practical to water them. Also, it would provide her another fun ""toy"" to jump and swat with her paws.
Any recommendations on keeping her from biting our plants?


I'd avoid hot pepper oil as a deterrent in case your kitty gets it in her eyes or mouth - ouch! A safe alternative is something called 'bitter apple' spray which is often available from vets or pet supply shops and will not harm your plants. Vets often suggest it as a deterrent for pets that are chewing or licking inappropriately.
Does your cat have enough 'toys'? It won't completely stop her from nibbling your plants, but if there's something fun to keep her preoccupied, she might bother the plants less often. Bored cats like to make mischief which I know from experience. After my two were given outdoor access, they caused a lot less havoc indoors and leave the house-plants alone. And as Suresh mentioned, it often helps to grow 'cat' grass (you can buy it as seed and it's easy to grow) or even a catnip plant to which your cat can have free access. 
"
814,"I was using old clear (transparent) plastic meat packaging to grow plants in. Is that a good idea? Are there any side effects of roots possibly being exposed to the sun?



If you're stuck for containers and this is your only option (or you want to be environmentally friendly and re-use those pesky non-recyclable food trays), you could glue something like black paper or cardboard to the outside to keep the light from getting through.
"
823,"Even if I remove all weeds around my strawberries a month's growth has them smothered in grasses, clover and other weeds. Is there anything I can put down that will help, or do I just need to manually weed all the time?
(I want to eat the strawberries, so don't want to use weedkillers) 


This might be an application for ""landscape fabric""? Also known as ""weed fabric"", the big box sellers in the US have it. When preparing your bed, you put this fabric down, and perhaps cover it with mulch to make it look better. Then cut a hole in the fabric for each strawberry plant. The weeds are blocked by the fabric, and the strawberries grow through their holes - or that is the idea. 
"
827,"I have a lovely jade plant (Crassula Ovata) growing in the bathroom, but it keeps outgrowing pots and needing to be repotted. I have tried moving it further from the sun and watering it less to try and slow its growth, as I read somewhere that works, but it doesn't take too well to that.
Is it just something I need to live with, or are there ways to slow the growth of succulents?


What kind of succulent?
If it's like most succulents, you can absolutely just trim the ends off the plant and it will be fine (and, if you wanted, you could plant those and make new plants to keep or give away).
Additionally, many plants will cooperate well with root pruning, like what bonsai growers do. This typically involves taking the plant out of the pot, removing all the soil from the roots so that you can see what you are doing, and removing the largest root or two. The most effective roots are actually the smallest ones, for reasons of surface area. 
However, this is only a general answer, and to be sure that the answer is a good one for your situation, I would absolutely need to know the specific kind of plant.
"
828,"Even if I remove all weeds around my strawberries a month's growth has them smothered in grasses, clover and other weeds. Is there anything I can put down that will help, or do I just need to manually weed all the time?
(I want to eat the strawberries, so don't want to use weedkillers) 


I find that putting down some sort of mulch will help with keeping weeds down and water in. 
You can certainly buy mulch, but if you happen to have leaves or grasses you recently trimmed (really, anything that is not going to try to grow on you! So no roots, and no succulents), you can put them down around your strawberries. This tends to be easier, in my experience, with recently cut leaves and grasses, simply because they are still pliable. If, however, you have dried out stuff, you can just be sure to layer it more carefully. The only real problem with using this kind of mulch is that it will biodegrade more quickly.
When you have runners, you can always move aside your mulch to allow the runners to root.
"
829,"Last year I used row covers on PVC frames to effectively keep cabbage worms off my broccoli and cabbage. I put the covers on in spring as soon as I put the seedlings in the ground, and then took them off when the plants were larger. There were some worms in the broccoli when I harvested, but they don't do much damage and come out of the heads with a good soaking when brought inside.
This year I didn't put the covers on early like I should have, and I'm wondering: is worth my time to put covers over more mature plants that already have cabbage worms? Will I just be ""locking the bad bugs in""? What if I first spray with Bt, which seems to have been effective at controlling them so far, and then cover?


I would personally use BT, and then use row covers.
I will note that I have not yet grown anything in that family yet, but from what I found online, these critters have 3-5 overlapping generations (I had a suspicion that this was going to be the case). So BT should kill off the current larva, and covering should prevent additional ones.
"
831,"I started using fertilizer spikes on my dwarfed citrus trees in small pots.  (Details may be found in this question.)  As suggested, I used half a spike for each pot and I put the spike as far from any roots as possible.
My understanding is that the risk I'm taking is that the fertilizer will burn the roots of these trees.  But I don't know what to look for.  Should I check the color of the leaves?  What color would I expect from fertilizer burn?  How long might it take to see symptoms?


As far as I am aware, fertilizer burn is a result of too much fertilizer causing the water in the plant to be drawn out. This makes leaves look, well, burned. 
In a specific search on citrus trees, it sounds like ""Dark green, lush leaves with burned tips indicate excessive fertilizing"".
I suggest watching to see if the leaves start showing any signs of burned tips, while keeping in mind that this is likely how the leaves would also look if they are under-watered (for the same reason, basically).
The fact that it's half a spike should mean you're fine, I would think.
"
833,"This is the first year I've grown carrots. What gave them legs?

I have a theory that the seedlings merged together. I don't know if that is just silly or if carrots just naturally grow like this.


Anything that impedes the downward growth of the root will do this: stony soil, heavy soil (carrots prefer lighter soils), even damage from pests.
"
834,"This is the first year I've grown carrots. What gave them legs?

I have a theory that the seedlings merged together. I don't know if that is just silly or if carrots just naturally grow like this.


Carrots often develop forked roots when:

the soil is stony
manure is added to the plot shortly before sowing
the bed is too firm
the soil is very heavy and has not been dug sufficiently - carrots like light,     well-drained fertile soil

If your soil is stony - and this is what usually causes the problem -, you should have better luck with a short-rooted variety such as Amsterdam.
"
836,"I was using old clear (transparent) plastic meat packaging to grow plants in. Is that a good idea? Are there any side effects of roots possibly being exposed to the sun?



What do you mean when you say that you are using clear plastic containers to grow plants? 
Starting from seed, as seedlings, indoor plants that don't want direct light and whose roots aren't totally root bound? 
I suspect all of the above would be fine, although the indoor plants may have problem with not enough soil depending upon the plant. Similarly, there may be some seedlings which need deeper soil level than that.
The other replies are all applicable, but I can think of situations where it would not be a problem, and there are probably others. What is your goal, and what are the specifics?
curious
"
838,"I live in central Scotland, which is a bit damp, and the soil in my garden, despite years of aerating, adding sand etc is still quite a thick clay soil.
When it is sunny I get sun all day long, so plants that take root seem to grow well, but I find it very hit or miss as to which ones work. (Hebes, Hostas, Cotoneasters, Willows all work well, as do some climbers, but Roses, Firs have trouble. As you'll see from my previous post, grasses, clover, daisies etc love it:-(
Is there any guidance as to which ones might thrive in this environment, or perhaps some early care recommendations. Ideally plants favourable to bees, birds such as finches and tits and wildlife in general.


The soil in my area is light and sandy (easy to dig, but less able to retain water and nutrients - quite a challenge during dry spells!), so, unfortunately, I can't speak from experience. However, you may find the following articles helpful:
Top Ten Plants for Clay Soil
Plants for Clay Soil
Top Ten Plants for Heavy Clay
"
842,"After starting our tomato plants from seed this year, we have many more small plants in the ground than in the past years. We are looking to make our own inexpensive and durable cages that we could use year after year. 
What are starting materials that we can use? Are there materials to avoid? It seems that the openings in chicken wire and hardware cloth are too narrow. 


Watch the video in this answer to a question about pruning. They demonstrate a strategy for staking that uses twine woven between the plants to support them as they grow.
I have some tomatoes in cages but also have a bunch that I'm going to support using the weave shown in that video.
"
